"violation.code","violation.description"
"04F","Food, food preparation area, food storage area, area used by employees or patrons, contaminated by sewage or liquid waste."
"04E","Toxic chemical improperly labeled, stored or used such that food contamination may occur."
"16D","Required nutritional information statement not posted (2,000 calories per day)."
"19-11","Providing compostable plastic straws to be used outside of the food establishment’s premises; failure to appropriately dispose of compostable plastic straws; failure to maintain required bins for disposal of compostable plastic straws."
"19-05","Providing single-use plastic stirrers or single-use plastic splash sticks."
"18B","Document issued by the Board of Health, Commissioner or Department unlawfully reproduced or altered."
"06H","Records and logs not maintained to demonstrate that HACCP plan has been properly implemented."
"09D","Food service operation occurring in room or area used as living or sleeping quarters."
"15A1","No Smoking permitted in an area where it is prohibited"
"15I","“No Smoking” and/or “Smoking Permitted” sign not conspicuously posted. Health warning not present on “Smoking Permitted” sign."
"05C","Food contact surface improperly constructed or located. Unacceptable material used."
"15F2","Operator failed to make a good faith effort to inform smokers or users of electronic cigarettes of the SFAA"
"20-05","Current letter grade or ""Grade Pending"" card not conspicuously posted or visible to passersby"
"02D","Precooked potentially hazardous food from commercial food processing establishment that is supposed to be heated, but is not heated to 140º F within 2 hours."
"16-01","A food containing artificial trans-fat, with 0.5 grams or more of trans fat per serving, is being stored, distributed, held for service, used in preparation of a menu item, or served."
"07A","Duties of an officer of the Department interfered with or obstructed."
"15F7","Sign prohibiting smoking or using electronic cigarettes not conspicuously  posted"
"05C","Food contact surface, refillable, reusable containers, or equipment improperly constructed, placed or maintained. Unacceptable material used.  Culinary sink or other acceptable method not provided for washing food."
"16K","Sodium Warning - Icon not compliant"
"05C","Design, construction, materials used or maintenance of food contact surface improper.  Surface not easily cleanable, sanitized and maintained.  Culinary sink or other acceptable method not provided for washing food."
"05E","Toilet facility not provided for employees or for patrons when required. Shared patron-employee toilet accessed through kitchen, food prep or storage area or utensil washing area."
"05B","Harmful noxious gas or vapor detected. Carbon Monoxide (CO) level exceeds nine (9) ppm"
"03E","No or inadequate potable water supply. Water or ice not potable or from unapproved source. Bottled water not NY State certified. Cross connection in potable water supply system."
"02A","Food not cooked to required minimum temperature."
"02D","Commercially processed pre-cooked TCS in hermetically sealed containers and precooked TCS in intact packages from non-retail food processing establishments not heated to 140 °F within 2 hours of removal from container or package."
"04I","Non-TCS food that has been served to the public being re-served. (Does not apply to wrapped foods where the wrapper seal has not been broken or opened)."
"02F","Meat, fish, molluscan shellfish, unpasteurized raw shell eggs, poultry or other TCS offered or served raw or undercooked and written notice not provided to consumer."
"06H","Records and logs not maintained to show that approved HACCP plan has been properly implemented."
"10G","Food service operation occurring in room used as living or sleeping quarters."
"03E","Potable water supply inadequate. Water or ice not potable or from unapproved source. Cross connection in potable water supply system observed."
"20E","Letter grade or Grade Pending card not conspicuously posted and visible to passersby."
"16L","Sodium Warning - Statement"
"03D","Food package (including canned food product or hermetically sealed container) not in good condition to the degree contents are not suitable for human consumption.  Package is swollen, leaking or rusted, without “DO NOT USE” label or not segregated from consumable food items."
"18-01","Current valid permit, registration or other authorization to operate a Food Service Establishment (FSE) or Non-retail Food Processing Establishment (NRFP) not available."
"02F","Meat, fish or molluscan shellfish served raw or undercooked without prior notification to customer."
"03D","Food package (including canned food product or hermetically sealed container) not in good condition to the degree contents are not suitable for human consumption. Package is swollen, leaking or rusted, without “DO NOT USE” label or not segregated from consumable food items."
"03E","No or inadequate potable water supply. Water or ice not potable or from unapproved source. Bottled water not NY State certified.  Cross connection in potable water supply system."
"19-01","Organics containers not provided"
"05B","Harmful, noxious gas or vapor detected. CO =13 ppm."
"18-13","Failure to comply with an order of the Board of Health, Commissioner or Department."
"16-09","Sodium Warning icon posted on menus, menu boards or food tags for food items that contain 2300mg or more of sodium is not a black and white equilateral triangle; or the  equilateral triangle is not as wide as it is tall, or is not equal in height to the largest letter in the food item’s name, as displayed on the menu, menu board, or tag."
"19-03","Failure to post signage in organics collection area."
"16A","A food containing artificial trans fat, with 0.5 grams or more of trans fat per serving, is being stored, distributed, held for service, used in preparation of a menu item, or served."
"04P","Food containing a prohibited substance held, kept, offered, prepared, processed, packaged, or served."
"19-08","Failure to provide a single-use, non-compostable plastic straw upon request."
"03D","Canned food product observed swollen, leaking or rusted, and not segregated from other consumable food items."
"15S","Flavored tobacco products sold or offered for sale"
"18-14","Order or notice posted or required to be posted by the Department mutilated, obstructed or removed."
"04B","Food worker or vendor working or is knowingly or negligently permitted to work in FSE while afflicted with infected wound or reportable communicable disease. No spitting allowed. Spitting anywhere in the establishment is prohibited."
"15-17","Sale of tobacco products, herbal cigarettes, liquid nicotine, shisha, rolling papers or smoking paraphernalia to minors prohibited"
"22B","Toilet facility used by women does not have at least one covered garbage receptacle."
"15E3","Original label for smoking products sold or offered for sale"
"20-07","Letter grade or Grade Pending card removed, destroyed, modified, obscured, or otherwise tampered with"
"06I","Food not labeled in accordance with the approved HACCP plan"
"18-02","Current valid permit, registration or other authorization to operate a Temporary Food Service Establishment (TFSE) not available."
"06I","Food not labeled in accordance with HACCP plan."
"03C","Eggs found dirty/cracked; liquid, frozen or powdered eggs not pasteurized."
